{"run":43,"commit":"ab28b8c","metric":0,"metrics":{},"status":"crash","description":"Broadening the benchmark to short+long first-recording scenarios initially crashed because both scenarios ran concurrently and collided inside the shared FFmpeg worker filesystem.","timestamp":1774847718890,"segment":5,"confidence":null,"iterationTokens":112,"asi":{"hypothesis":"A mixed-duration benchmark will reduce overfitting to the current single 3-second workload and better represent real first-use latency.","rollback_reason":"Running scenarios in parallel against one worker/FFmpeg instance caused a filesystem collision (`ErrnoError: FS error`) during conversion.","learned":"The broader benchmark idea is still sound, but scenarios must run sequentially or use isolated worker/filesystem state.","next_action_hint":"Serialize the mixed scenarios and rerun the new baseline."}}
{"run":44,"commit":"781f73d","metric":4241.5,"metrics":{},"status":"keep","description":"Rebased the Firefox cold-start session onto a broader two-scenario benchmark that averages short 1s and longer 3s first-recording workloads, reducing overfitting to a single overlap window.","timestamp":1774847830172,"segment":5,"confidence":null,"iterationTokens":5693,"asi":{"hypothesis":"A mixed short/long workload is a better optimization target than only a 3s sample because real first recordings can vary widely in how much FFmpeg preload work they hide.","learned":"The broadened baseline lands around 4.24s average cold-start wait across 1s and 3s recordings, providing more realistic pressure on both preload overlap and conversion cost.","next_action_hint":"Use the per-scenario metrics to test whether future ideas help only the long-overlap case or also improve the short-recording first-use case."}}
{"run":45,"commit":"fdc3067","metric":4042.5,"metrics":{},"status":"keep","description":"Transferred the finished MP4 bytes back from the worker as an `ArrayBuffer` instead of a Blob, removing one more serialization/copy step on the Firefox conversion path.","timestamp":1774847916789,"segment":5,"confidence":null,"iterationTokens":2030,"asi":{"hypothesis":"On short first-recording scenarios especially, returning raw bytes from the worker may save enough post-encode overhead to improve the averaged cold-start metric.","learned":"This improved the broadened benchmark meaningfully (~4241.5ms → ~4042.5ms average cold) and also lowered average warm time. The remaining overhead after encoding still mattered.","tradeoff":"The converter now always reconstructs the final Blob on the main thread from transferred bytes, which is a little less direct but still simple and browser-plausible.","next_action_hint":"Confirm the gain once, then inspect whether it helps the short scenario more than the long one before deciding on further data-path work."}}
{"run":46,"commit":"fdc3067","metric":4596,"metrics":{},"status":"discard","description":"Re-ran the output-ArrayBuffer transfer change unchanged to see whether the mixed-workload cold-start improvement was stable.","timestamp":1774847983866,"segment":5,"confidence":20.314070351758794,"iterationTokens":1118,"asi":{"hypothesis":"If returning MP4 bytes from the worker is a real win, repeated runs should stay near the ~4.0s average-cold band rather than drifting back toward the old baseline.","rollback_reason":"No code change; confirmation-only run after already committing the output-byte transfer.","learned":"The mixed benchmark has meaningful variance, especially on the long scenario (`long_cold_transcode_ms` jumped to ~6.2s), so single-run wins on this broader workload need more skepticism.","next_action_hint":"Treat the output-byte-transfer win as promising but not fully settled; prioritize ideas that should improve both scenarios more deterministically, or add internal repeated medians if this workload remains too noisy."}}
{"type":"config","name":"Optimize EasyCord Firefox first-conversion MP4 speed (isolated short/long cold scenarios)","metricName":"cold_transcode_ms","metricUnit":"ms","bestDirection":"lower"}
{"run":47,"commit":"8f7d440","metric":2980.5,"metrics":{},"status":"keep","description":"Corrected the mixed-workload benchmark so short and long scenarios run in isolated browser contexts, ensuring each one measures a genuinely cold first conversion instead of sharing a warmed FFmpeg worker.","timestamp":1774848104513,"segment":6,"confidence":null,"iterationTokens":114,"asi":{"hypothesis":"The broader benchmark should isolate scenarios rather than run them back-to-back in one page, otherwise the second scenario is no longer a true cold-start measurement.","learned":"The prior mixed benchmark was undercounting/warping cold behavior by reusing worker state across scenarios. The isolated benchmark is cleaner and now reports ~2.98s average cold across 1s and 3s first-use cases.","next_action_hint":"Use this corrected benchmark going forward; future wins should improve both isolated cold scenarios, not just exploit cross-scenario state reuse."}}
{"run":48,"commit":"8f7d440","metric":3028.5,"metrics":{},"status":"discard","description":"Explicitly forced `-threads 1` on both the MPEG-4 primary path and H.264 fallback to see whether avoiding FFmpeg thread auto-detection would reduce cold-start overhead.","timestamp":1774848179118,"segment":6,"confidence":null,"iterationTokens":1549,"asi":{"hypothesis":"In single-threaded FFmpeg WASM, explicitly pinning thread count might shave off setup overhead or avoid unnecessary internal branching.","rollback_reason":"Average cold-start regressed slightly (~2980.5ms → ~3028.5ms), so explicit thread pinning did not help.","learned":"Thread-count auto-detection is not a meaningful bottleneck in this single-threaded browser build.","next_action_hint":"Focus on work-elimination changes rather than startup knobs like thread count."}}
{"run":49,"commit":"8f7d440","metric":3034,"metrics":{},"status":"discard","description":"Tried a fragmented MP4 primary output (`frag_keyframe+empty_moov+default_base_moof`) to see whether cheaper finalization would beat `+faststart` on Firefox.","timestamp":1774848241012,"segment":6,"confidence":null,"iterationTokens":1124,"asi":{"hypothesis":"For browser-local downloads, fragmented MP4 output might avoid some moov relocation/finalization work and reduce first-conversion latency.","rollback_reason":"Average cold-start regressed slightly (~2980.5ms → ~3034ms), so fragmented MP4 was not faster on this workload.","learned":"Final MP4 container finalization is not the dominant remaining cost. Encoder/core work still dominates over moov-layout tweaks.","next_action_hint":"Avoid more muxing-flag variations unless they remove substantial work; they are not paying off here."}}
{"run":50,"commit":"8f7d440","metric":3303.5,"metrics":{},"status":"discard","description":"Retested the MPEG-4 quality setting on the corrected isolated benchmark by moving from q=9 back to q=8.","timestamp":1774848308183,"segment":6,"confidence":null,"iterationTokens":800,"asi":{"hypothesis":"The corrected mixed cold benchmark may prefer a different speed/quality point than the older single-scenario harness, so q=8 was worth rechecking.","rollback_reason":"Average cold-start regressed sharply (~2980.5ms → ~3303.5ms), confirming q=9 is still the better point even on the corrected benchmark.","learned":"The q=9 choice remains robust across benchmark revisions; the remaining headroom is not hiding in nearby MPEG-4 quantizer settings.","next_action_hint":"Stop revisiting q-tuning and focus on broader workflow/benchmark realism or higher-level path changes."}}
{"run":51,"commit":"8f7d440","metric":3113.5,"metrics":{},"status":"discard","description":"Tried reducing FFmpeg input probing work with `-analyzeduration 0` and `-probesize 32768` on both transcode paths.","timestamp":1774848387869,"segment":6,"confidence":null,"iterationTokens":2014,"asi":{"hypothesis":"MediaRecorder WebM inputs are regular enough that FFmpeg may not need much probe/analyze work before starting conversion, especially on short first-use clips.","rollback_reason":"Average cold-start regressed (~2980.5ms → ~3113.5ms), so explicit probe/analyze reduction did not help this workload.","learned":"Input probing is not the dominant remaining cost for these browser-generated WebM files, or the tighter limits cause enough fallback work to erase any benefit.","next_action_hint":"Avoid more demuxer micro-tuning and focus on larger-grain lifecycle or workload-level improvements."}}
{"run":52,"commit":"129ac3c","metric":2755.5,"metrics":{},"status":"keep","description":"Made Firefox preload do a lightweight FFmpeg execution (`-version`) after core load, warming more of the runtime before the first real transcode starts.","timestamp":1774848465168,"segment":6,"confidence":3.3834586466165413,"iterationTokens":1308,"asi":{"hypothesis":"Current preload may only fetch/load the core, leaving some FFmpeg runtime initialization for the first real exec; a tiny warm-up exec during preload could move more of that cost off the critical path.","learned":"This produced a strong win on the corrected isolated benchmark (~2980.5ms → ~2755.5ms average cold) and also improved warm metrics, suggesting the first real exec had non-trivial one-time setup left in it.","tradeoff":"Preload now does slightly more background CPU work before the user stops recording, but that is aligned with the explicit goal of reducing first-stop wait.","next_action_hint":"Confirm this once. If stable, consider whether an even lighter dedicated warm-up command or dummy FS operation could preserve the win with less background work."}}
{"run":53,"commit":"129ac3c","metric":2782,"metrics":{},"status":"discard","description":"Re-ran the FFmpeg warm-up-exec preload unchanged to confirm the new lower cold-start band on the corrected benchmark.","timestamp":1774848515925,"segment":6,"confidence":2.6470588235294117,"iterationTokens":1147,"asi":{"hypothesis":"If the preload `-version` warm-up is a real improvement, an immediate rerun should stay near the new ~2.76–2.78s average cold band.","rollback_reason":"No code change; confirmation-only run after already committing the warm-up preload.","learned":"The improvement reproduced closely (~2782ms after ~2755.5ms), so the preload exec warm-up looks stable rather than lucky.","next_action_hint":"Use this warmed preload as the new baseline and only pursue follow-ups that plausibly reduce work further without making preload disproportionately heavy."}}
{"run":54,"commit":"129ac3c","metric":3305,"metrics":{},"status":"discard","description":"Tested a lighter preload warm-up by doing a tiny FFmpeg FS write/delete instead of the `-version` exec.","timestamp":1774848580676,"segment":6,"confidence":1.3574660633484164,"iterationTokens":896,"asi":{"hypothesis":"If the main benefit of preload warm-up is filesystem/runtime activation rather than command execution itself, a tiny write/delete could keep most of the win with less background work.","rollback_reason":"Average cold-start regressed sharply (~2755–2782ms band → ~3305ms), so the warm-up benefit clearly comes from priming actual exec-path initialization, not just touching the virtual FS.","learned":"The expensive one-time work is in FFmpeg's execution path, not merely filesystem setup.","next_action_hint":"Keep the `-version` warm-up. If pursuing more preload work, it should target exec-path initialization rather than dummy FS activity."}}
{"run":55,"commit":"129ac3c","metric":3743.5,"metrics":{},"status":"discard","description":"Tried replacing the cheap preload `-version` warm-up with a tiny synthetic MP4 encode so codec/muxer paths would be initialized before the first real Firefox conversion.","timestamp":1774848713796,"segment":6,"confidence":0.8928571428571429,"iterationTokens":3950,"asi":{"hypothesis":"If the remaining one-time cold-start cost is specifically codec/muxer initialization, a miniature synthetic encode during preload might outperform a mere CLI `-version` warm-up.","rollback_reason":"Average cold-start regressed badly (~2755–2782ms band → ~3743.5ms), so the heavier preload burned too much background time relative to what it saved later.","learned":"The sweet spot is a very cheap exec that warms the FFmpeg execution path, not a dummy encode. Preload should stay lightweight.","next_action_hint":"Keep the `-version` warm-up and avoid heavier preload tasks unless they can run much earlier in the user flow."}}
{"run":56,"commit":"129ac3c","metric":3955,"metrics":{},"status":"discard","description":"Tried moving file cleanup off the critical path by using unique per-job FFmpeg filenames and deleting them asynchronously after posting the result.","timestamp":1774848863835,"segment":6,"confidence":0.9761388286334056,"iterationTokens":4597,"asi":{"hypothesis":"Synchronous `deleteFile` calls after reading the output may still be adding unnecessary tail latency to the first conversion; unique filenames could let cleanup happen after the result is delivered.","rollback_reason":"Average cold-start regressed badly (~2755–2782ms band → ~3955ms), so deferred cleanup and per-job filenames added more overhead/complexity than they removed.","learned":"FFmpeg filesystem cleanup is not the dominant tail-latency cost here. Extra path allocation/string churn and deferred operations are worse than the simple synchronous cleanup.","next_action_hint":"Keep the simple fixed filenames and synchronous cleanup; focus on truly one-time initialization work instead of tail cleanup micro-optimizations."}}
{"run":57,"commit":"129ac3c","metric":3661,"metrics":{},"status":"discard","description":"User-requested confirmation benchmark run on the current Firefox MP4 cold-start optimization stack.","timestamp":1774849089209,"segment":6,"confidence":1.174934725848564,"iterationTokens":4597,"asi":{"hypothesis":"A fresh rerun will show whether the current optimized Firefox path still lands near the recently observed cold-start band or if the broader benchmark remains noisy.","rollback_reason":"No code change; verification-only run requested by the user.","learned":"This run came back slower (~3661ms average cold), which reinforces that the mixed isolated benchmark still has noticeable variance and single runs should not be overinterpreted.","next_action_hint":"If the goal is confidence rather than a new optimization, run multiple confirmations and compare the band rather than relying on one sample."}}
{"run":58,"commit":"129ac3c","metric":3357,"metrics":{},"status":"discard","description":"Moved Firefox prewarm in the real app from recording start to camera-ready time so runtime behavior better matches the intended user flow and the benchmark's earlier overlap model.","timestamp":1774849207806,"segment":6,"confidence":1.1029411764705883,"iterationTokens":7758,"asi":{"hypothesis":"If EasyCord starts the camera well before the first recording, prewarming at camera readiness should improve real user experience and better align app behavior with the benchmark's overlap assumptions.","rollback_reason":"The benchmark itself did not materially benefit and average cold-start regressed on this run, so this app-only timing shift does not justify keeping without a stronger product-side measurement.","learned":"Changing app prewarm timing alone is not enough to improve the isolated cold benchmark, which is dominated by benchmark-controlled timing rather than UI lifecycle details.","next_action_hint":"If revisiting earlier app prewarm, validate it with a truly app-driven end-to-end benchmark rather than the current synthetic conversion harness."}}
{"type":"config","name":"Optimize EasyCord Firefox first-conversion MP4 speed (isolated short/long medians)","metricName":"cold_transcode_ms","metricUnit":"ms","bestDirection":"lower"}
{"run":59,"commit":"edacd93","metric":3743,"metrics":{},"status":"keep","description":"Rebased the Firefox cold-start benchmark again so each isolated short/long scenario is repeated twice and summarized by median, reducing variance before further optimization.","timestamp":1774849380747,"segment":7,"confidence":null,"iterationTokens":114,"asi":{"hypothesis":"The corrected isolated benchmark still showed enough variance that medians per scenario are worth the extra runtime to make optimization decisions more trustworthy.","learned":"The stabilized mixed benchmark now centers around ~3743ms average cold for the current code. It is slower to run but should make subsequent keep/discard calls more reliable.","next_action_hint":"Optimize against this steadier signal and avoid overreacting to one-off fast spikes."}}
{"run":60,"commit":"edacd93","metric":4552.5,"metrics":{},"status":"discard","description":"Re-tested the previously noisy MPEG-4 `-bf 0` tweak on the new median-stabilized benchmark.","timestamp":1774849492183,"segment":7,"confidence":null,"iterationTokens":1146,"asi":{"hypothesis":"If disabling B-frames was a real improvement and not just noise, the steadier repeated-median benchmark should reveal it clearly.","rollback_reason":"On the stabilized benchmark it regressed badly (~3743ms → ~4552.5ms), so the earlier apparent win was indeed noise.","learned":"`-bf 0` is now conclusively a non-win for this workload. The median-stabilized benchmark paid for itself by killing this false lead.","next_action_hint":"Stop considering `-bf 0` entirely and focus on initialization/data-path ideas rather than MPEG-4 encoder micro-tweaks."}}
{"run":61,"commit":"0a6bda1","metric":3366.5,"metrics":{},"status":"keep","description":"Suppressed FFmpeg banner/log output on both preload and real transcodes, and stopped forwarding worker log events, reducing first-conversion overhead on the stabilized cold benchmark.","timestamp":1774849616373,"segment":7,"confidence":1,"iterationTokens":3217,"asi":{"hypothesis":"Even with the median-stabilized benchmark, FFmpeg CLI logging and worker log forwarding may still impose measurable overhead during preload and the first real conversion.","learned":"This produced a clear win on the stabilized benchmark (~3743ms → ~3366.5ms). FFmpeg/userland logging overhead was still material after the bigger architectural wins.","tradeoff":"Less verbose FFmpeg logging means less low-level debugging detail from the worker during normal operation, but progress updates and explicit error messages remain.","next_action_hint":"Confirm once on the stabilized benchmark. If it holds, consider whether progress messages can be similarly reduced without hurting UX too much."}}
{"run":62,"commit":"0a6bda1","metric":3544,"metrics":{},"status":"discard","description":"Re-ran the FFmpeg log-suppression change unchanged to confirm whether the stabilized cold-start improvement held up.","timestamp":1774849701463,"segment":7,"confidence":2,"iterationTokens":728,"asi":{"hypothesis":"If suppressing FFmpeg banner/log output is a real win, the repeat should remain below the old ~3743ms stabilized baseline even if it is not as fast as the first run.","rollback_reason":"No code change; confirmation-only run after already committing the log-suppression change.","learned":"The confirmation run came back slower than the first keep but still better than the old stabilized baseline (~3544ms vs ~3743ms), so the improvement appears real but modest rather than huge.","next_action_hint":"Keep the logging reduction, but treat the true gain as moderate. Future wins should come from removing real work, not expecting another big logging windfall."}}
{"run":63,"commit":"0a6bda1","metric":4380.5,"metrics":{},"status":"discard","description":"Tried coarsening worker progress updates to 10% buckets after suppressing FFmpeg logs, to see if fewer UI messages would further reduce cold-start overhead.","timestamp":1774849817693,"segment":7,"confidence":1,"iterationTokens":1120,"asi":{"hypothesis":"With FFmpeg logging already suppressed, progress-message frequency might still be adding measurable main-thread overhead during Firefox conversion.","rollback_reason":"Average cold-start regressed sharply (~3366–3544ms band → ~4380.5ms), so coarsening progress updates is not a win on the stabilized benchmark.","learned":"Progress-event traffic is not the bottleneck; in fact, the current behavior may interact better with FFmpeg's internal timing than the coarse-bucket variant.","next_action_hint":"Keep full progress updates and look elsewhere; messaging overhead has been mined out."}}
{"run":64,"commit":"0a6bda1","metric":3564.5,"metrics":{},"status":"discard","description":"Made the real conversion path await any in-flight preload warm-up before starting FFmpeg work, to avoid overlap contention on short first-recording scenarios.","timestamp":1774850020990,"segment":7,"confidence":1.8967254408060454,"iterationTokens":5364,"asi":{"hypothesis":"On the 1s scenario especially, convert may currently race with the background preload exec; awaiting that warm-up might trade a small wait for lower contention and a faster overall cold path.","rollback_reason":"Average cold-start regressed versus the current optimized head, so forcing convert to wait for preload completion was not a net win.","learned":"The best behavior is opportunistic overlap: letting preload run in the background helps more than serializing the convert path behind it.","next_action_hint":"Keep preload fire-and-forget. Further improvements should reduce actual one-time work rather than enforcing stricter ordering."}}
{"type":"config","name":"Optimize EasyCord Firefox first-conversion MP4 speed (zero-gap and gesture-hold cold flows)","metricName":"cold_transcode_ms","metricUnit":"ms","bestDirection":"lower"}
