{"type":"config","name":"Optimize EasyCord gesture recognition accuracy","metricName":"accuracy_score","metricUnit":"","bestDirection":"higher"}
{"run":1,"commit":"94b023b","metric":79,"metrics":{},"status":"keep","description":"Baseline extracted shared temporal decision engine and added a scenario-suite benchmark for noisy hold detection accuracy.","timestamp":1774841617475,"segment":0,"confidence":null,"iterationTokens":86,"asi":{"hypothesis":"A realistic temporal benchmark around noisy sustained holds, dropouts, and spike rejection will expose whether gesture accuracy improvements are possible without touching model weights.","files_in_scope":["src/utils/gestureManager.ts","src/utils/gestureDecision.ts","scripts/gesture_accuracy_benchmark.mjs"],"learned":"Current logic never false-triggers in the suite but misses many borderline holds because any brief misclassification fully resets the 3s timer.","next_action_hint":"Try temporal smoothing / grace-window logic that tolerates short gaps without allowing spike-based false triggers."}}
{"run":2,"commit":"ffa7665","metric":80.891,"metrics":{},"status":"keep","description":"Added a short interruption grace window so sustained holds survive brief 'None' dropouts instead of restarting immediately.","timestamp":1774841672850,"segment":0,"confidence":null,"iterationTokens":2085,"asi":{"hypothesis":"Real webcam streams often contain single-frame losses; tolerating very short interruptions should increase hold-trigger recall more than it harms false positives.","learned":"A 220ms dropout grace improved recall materially (+11 fewer misses) with only one new false trigger across the synthetic suite.","tradeoff":"Grace windows help on detection dropouts but can leak into false positives if they also forgive wrong-gesture intervals.","next_action_hint":"Differentiate between benign dropouts and explicit wrong gestures; keep forgiving 'None'/no-hand blips but be stricter when a different gesture is seen."}}
{"run":3,"commit":"ffa7665","metric":80.891,"metrics":{},"status":"discard","description":"Tried asymmetric grace windows: longer forgiveness for no-hand dropouts and shorter forgiveness for visible-hand uncertain frames.","timestamp":1774841700833,"segment":0,"confidence":null,"iterationTokens":1265,"asi":{"hypothesis":"Visible-hand 'None' classifications may be riskier than full tracking loss, so asymmetric grace might preserve recall while reducing false positives.","rollback_reason":"No measurable improvement versus the prior grace-window version; metrics were identical on the suite.","learned":"The lone false trigger is not caused by treating no-hand and visible-hand 'None' equally, or at least not at the tested thresholds.","next_action_hint":"Try structural smoothing of raw gesture labels before hold timing, such as short majority voting or score accumulation, rather than only tweaking reset thresholds."}}
{"run":4,"commit":"2bd2a56","metric":95.72,"metrics":{},"status":"keep","description":"Allowed very brief wrong-gesture blips before resetting an active hold, so single-frame misclassifications no longer destroy near-complete holds.","timestamp":1774841746442,"segment":0,"confidence":17.68376520359593,"iterationTokens":2368,"asi":{"hypothesis":"MediaPipe can momentarily classify the wrong gesture even while the user's true pose is unchanged; a short confirmation window before switching gestures should recover many missed holds.","learned":"This was the big bottleneck: forgiving ~90ms of wrong-gesture noise collapsed misses from 97 to 10, but it also increased accidental triggers to 10 and slightly raised timing latency.","tradeoff":"Much higher recall at the cost of some false-positive risk; likely closer to real-world usability, but worth trying follow-up guardrails to trim the false triggers.","next_action_hint":"Keep the switch-confirmation idea and explore lightweight anti-spike guardrails, such as requiring a minimum number of matching frames before trigger once recovery from interruption has occurred."}}
{"run":5,"commit":"c199107","metric":99.253,"metrics":{},"status":"keep","description":"Aligned engine output with the stabilized active gesture so triggers fire for the debounced decision instead of the noisy instantaneous frame label.","timestamp":1774841800693,"segment":0,"confidence":10.710206240084581,"iterationTokens":2880,"asi":{"hypothesis":"If smoothing decides a hold is valid, the emitted gesture should reflect that stabilized decision; otherwise the app can miss real triggers during brief noisy frames.","learned":"This fixed the remaining misses/false positives in the suite: the prior errors were largely output-alignment bugs, not the hold logic itself.","bug_root_cause":"`isTriggered` was derived from `activeGesture`, but `gesture` returned to the app remained the raw current frame, allowing `None` or a wrong one-frame blip to suppress or mislabel the action.","next_action_hint":"Probe for over-aggressive behavior with harder adversarial scenarios; if current logic holds up, document the change and capture future ideas rather than adding complexity for tiny gains."}}
{"type":"config","name":"Optimize EasyCord gesture recognition accuracy (expanded adversarial benchmark)","metricName":"accuracy_score","metricUnit":"","bestDirection":"higher"}
{"run":6,"commit":"e56b46e","metric":94.378,"metrics":{},"status":"keep","description":"Rebased the session on an expanded accuracy benchmark that adds alternating-gesture confusion scenarios to catch over-aggressive temporal smoothing.","timestamp":1774841863966,"segment":1,"confidence":null,"iterationTokens":105,"asi":{"hypothesis":"The previous suite under-tested adversarial oscillation; adding a harder scenario will better reflect real-world misclassification bursts and prevent overclaiming accuracy gains.","learned":"Current smoothed logic still has perfect recall on the suite but accumulates 36 false triggers once rapid gesture alternation is included.","next_action_hint":"Add a continuity guard so opposite-gesture evidence actively erodes an in-progress hold instead of letting it coast through repeated alternation."}}
{"run":7,"commit":"e56b46e","metric":91.25,"metrics":{},"status":"discard","description":"Paused the hold timer during interruptions so only uninterrupted evidence counts toward the 3-second trigger window.","timestamp":1774841932257,"segment":1,"confidence":null,"iterationTokens":2650,"asi":{"hypothesis":"Subtracting interruption time should stop alternating-gesture oscillations from accumulating enough wall-clock time to trigger while preserving tolerance for brief blips.","rollback_reason":"Score regressed sharply: many expected holds were now missed, while alternating-confusion false triggers were not reduced in the current implementation.","learned":"Simply pausing the timer is not sufficient; the false-trigger path is more about retaining active gesture state too aggressively than about wall-clock accumulation alone.","next_action_hint":"Inspect the alternating-confusion traces directly and consider an evidence/decay model where contradictory gesture observations actively erode active-gesture confidence."}}
{"run":8,"commit":"a0f7945","metric":99.007,"metrics":{},"status":"keep","description":"Switched to a calibrated evidence-accumulation model: matching frames add slightly faster than real time, dropouts decay gently, and contradictory gestures decay progress instead of letting oscillation coast to a trigger.","timestamp":1774842053725,"segment":1,"confidence":1.4798593350383646,"iterationTokens":3517,"asi":{"hypothesis":"A gain/decay evidence model should balance recall and robustness better than pure wall-clock holds with grace windows.","search_hint":"An offline sweep pointed to MATCH_GAIN≈1.1, NO_HAND_DECAY≈0.2, WRONG_GESTURE_DECAY≈0.5 as a strong region before formal validation.","learned":"This nearly eliminates the adversarial alternating-gesture false positives while keeping high recall: only 3 misses remain and false triggers dropped from 36 to 0 on the expanded suite.","next_action_hint":"Inspect the remaining 3 misses before adding more complexity; if they are narrow borderline cases, capture future ideas in the backlog and consider stopping on simplicity grounds."}}
{"run":9,"commit":"a0f7945","metric":99.007,"metrics":{},"status":"discard","description":"Re-ran the current best evidence-accumulation model unchanged to estimate benchmark noise on the expanded suite.","timestamp":1774842216825,"segment":1,"confidence":1.9999999999999938,"iterationTokens":6095,"asi":{"hypothesis":"A no-change rerun will tell us whether the previous +4.9% improvement is stable or mostly benchmark noise.","rollback_reason":"No code change; this run was for confirmation only.","learned":"The benchmark is effectively deterministic at the current seed set, so the current best score is stable rather than noise-driven.","next_action_hint":"If making further changes, prioritize genuinely more realistic signal (e.g. confidence-aware weighting) instead of tiny threshold nudges."}}
{"run":10,"commit":"a0f7945","metric":79.378,"metrics":{},"status":"discard","description":"Tried confidence-aware evidence weighting using MediaPipe score-like signals in both runtime wiring and the synthetic benchmark.","timestamp":1774842280254,"segment":1,"confidence":1,"iterationTokens":2609,"asi":{"hypothesis":"If frame-level category confidence is informative, high-confidence matches should strengthen holds while low-confidence noise should contribute less.","rollback_reason":"The first confidence-aware formulation collapsed badly: misses and false triggers both exploded, indicating the weighting destabilized the evidence dynamics and/or the synthetic confidence calibration was unrealistic.","learned":"Naively multiplying both accumulation and decay by confidence can create pathological behavior. Confidence integration needs much tighter semantics than 'score as a generic multiplier'.","next_action_hint":"Return to the stable non-confidence model, then inspect whether confidence should only gate strong contradictions or only boost high-confidence matches—not both at once."}}
{"type":"config","name":"Optimize EasyCord gesture recognition accuracy (bursty wrong-gesture benchmark)","metricName":"accuracy_score","metricUnit":"","bestDirection":"higher"}
{"run":11,"commit":"8625f28","metric":93.753,"metrics":{},"status":"keep","description":"Expanded the benchmark again to include realistic short wrong-gesture bursts during an otherwise valid sustained hold, preventing over-optimization to simpler noise patterns.","timestamp":1774842397835,"segment":2,"confidence":null,"iterationTokens":107,"asi":{"hypothesis":"Periodic 100–130ms wrong-gesture bursts are plausible in webcam classification and should be part of the optimization target.","learned":"The current best model is much weaker on this harder workload than on the prior suite: 41 misses and 1 false trigger remain, so there is still meaningful headroom.","next_action_hint":"Try a slightly longer wrong-gesture confirmation window or a softer contradiction decay so brief wrong bursts do not erase too much evidence."}}
{"run":12,"commit":"dc70d71","metric":98.711,"metrics":{},"status":"keep","description":"Made wrong-gesture bursts less destructive by extending switch confirmation to 110ms and reducing contradiction decay, so short misclassification runs no longer erase most accumulated hold evidence.","timestamp":1774842456530,"segment":2,"confidence":null,"iterationTokens":3353,"asi":{"hypothesis":"Periodic 4-frame wrong-gesture bursts are classifier noise, not true intent changes, so the engine should tolerate them similarly to short dropouts.","learned":"This recovered almost all of the new bursty-hold misses (41 → 5) while keeping false triggers flat at 1; the broader benchmark strongly prefers softer contradiction handling.","tradeoff":"The model is now more permissive of short contradictory bursts, so future validation should focus on whether real gesture-switch responsiveness remains acceptable.","next_action_hint":"Inspect the single remaining false trigger and the last few misses before deciding whether more complexity is justified."}}
{"run":13,"commit":"33ba0d0","metric":99.121,"metrics":{},"status":"keep","description":"Fine-tuned the evidence model: slightly reduced match gain and softened no-hand decay, which eliminated the last false trigger while recovering more borderline dropout holds.","timestamp":1774842548519,"segment":2,"confidence":13.092682926829365,"iterationTokens":5283,"asi":{"hypothesis":"The remaining error pattern suggested the model was still a touch too eager on clean matches and a touch too harsh on brief dropouts.","learned":"MATCH_GAIN=1.095 and NO_HAND_DECAY=0.15 outperform the prior calibration on the broader benchmark: false triggers fell from 1 to 0 and misses from 5 to 3.","tradeoff":"This is still a synthetic-benchmark calibration, so further tuning should probably stop unless new realistic failure modes are added; the simple model is already near-saturated.","next_action_hint":"Re-run once for confirmation, then either stop on simplicity grounds or only continue if a clearly realistic new workload is introduced."}}
{"run":14,"commit":"33ba0d0","metric":99.121,"metrics":{},"status":"discard","description":"Re-ran the current best broader-benchmark calibration unchanged to confirm stability.","timestamp":1774842578078,"segment":2,"confidence":26.18536585365873,"iterationTokens":717,"asi":{"hypothesis":"The current best score should reproduce exactly if the new broader benchmark is deterministic and the improvement is real.","rollback_reason":"No code change; confirmation-only run.","learned":"The broader benchmark is deterministic under the fixed scenario set, and the 99.121 score reproduced exactly.","next_action_hint":"Avoid more threshold fiddling unless a genuinely new realistic scenario or live-camera validation signal is added."}}
{"run":15,"commit":"4a7c635","metric":99.222,"metrics":{},"status":"keep","description":"Stopped subtracting evidence on the very first contradictory frame, treating single-frame wrong-gesture blips as pure jitter unless they persist into a second frame.","timestamp":1774842676129,"segment":2,"confidence":54.14851485148558,"iterationTokens":3186,"asi":{"hypothesis":"The first opposite-label frame is often just classifier flicker, so it should start switch confirmation but not immediately erode an otherwise strong hold.","learned":"This simple change improved the broader benchmark again (misses 3 → 2, false triggers stayed at 0) without adding new state or complexity.","tradeoff":"Sustained contradictory evidence still decays and eventually switches, so responsiveness is preserved while single-frame blips are ignored.","next_action_hint":"Inspect the last 2 misses; if they are narrow borderline-dropout cases, try a similarly minimal refinement there rather than introducing score-aware complexity."}}
{"type":"config","name":"Optimize EasyCord Firefox MP4 transcoding speed","metricName":"warm_transcode_ms","metricUnit":"ms","bestDirection":"lower"}
{"run":16,"commit":"8640769","metric":0,"metrics":{},"status":"crash","description":"Initial Firefox benchmark harness attempt failed because a plain Node runner could not resolve the ephemeral npx-installed Playwright package.","timestamp":1774844938481,"segment":3,"confidence":null,"iterationTokens":171,"asi":{"hypothesis":"A custom Node runner using `npx -p playwright node ...` would be enough to drive headless Firefox without adding a local dependency.","rollback_reason":"`import('playwright')` failed under the Node runner because npm exec exposed the binary but not package resolution for ESM imports.","learned":"Use Playwright's own test runner/config instead of a bespoke Node launcher when benchmarking without a local dependency.","next_action_hint":"Switch the harness to `npx playwright test` with a dedicated config and rerun the baseline."}}
{"run":17,"commit":"8640769","metric":0,"metrics":{},"status":"crash","description":"Second harness attempt failed because the benchmark files imported `@playwright/test`, but the npx-provided Playwright bundle exposed the test runner via `playwright/test` instead.","timestamp":1774845025378,"segment":3,"confidence":null,"iterationTokens":6349,"asi":{"hypothesis":"The Playwright CLI environment would provide the standard `@playwright/test` module for the benchmark config and spec.","rollback_reason":"Under the ephemeral npx install, `@playwright/test` was unresolved; the correct import path for this setup is `playwright/test`.","learned":"The harness should target the module entrypoints shipped by the package actually invoked via `npx playwright`, not assume a separate `@playwright/test` package.","next_action_hint":"Switch imports to `playwright/test` and rerun the baseline."}}
{"run":18,"commit":"8640769","metric":0,"metrics":{},"status":"crash","description":"The first full Playwright baseline failed because the system Firefox binary exited immediately under Playwright's juggler protocol instead of staying attached for automation.","timestamp":1774845136511,"segment":3,"confidence":null,"iterationTokens":4998,"asi":{"hypothesis":"The locally installed Firefox.app binary could be automated directly by Playwright without downloading its bundled browser build.","rollback_reason":"Playwright launched Firefox with `-juggler-pipe`, but the process exited cleanly before automation attached; the stock browser build is not suitable here.","learned":"Use Playwright's managed Firefox browser instead of the system app for this benchmark harness.","next_action_hint":"Install Playwright's Firefox browser, remove the custom executable path override, validate the harness with plain bash, then rerun the baseline."}}
{"run":19,"commit":"8da2539","metric":5504,"metrics":{},"status":"keep","description":"Established a working Firefox-only browser benchmark around the real WebM→FFmpeg WASM→MP4 path, using Playwright plus an in-browser synthetic recording workload as the new baseline.","timestamp":1774845310496,"segment":3,"confidence":null,"iterationTokens":5116,"asi":{"hypothesis":"A real browser harness is necessary before optimizing Firefox MP4 conversion, because Node-side proxies miss worker startup, blob transfer, and Firefox MediaRecorder behavior.","files_in_scope":["src/utils/videoConverter.ts","src/utils/ffmpegWorker.ts","src/components/EasyCord.tsx","src/benchmarks/firefoxTranscodeBenchmark.ts","firefox-transcode-benchmark.html","scripts/firefox_transcode_benchmark.spec.mjs","playwright.firefox-bench.config.mjs"],"learned":"The benchmark is now runnable and stable enough to optimize against; current baseline is ~5.5s warm and ~10s cold for a 3s 640x360 sample in Firefox.","next_action_hint":"Inspect the conversion path for avoidable data copies and cold-start overhead, starting with Blob→worker transfer and FFmpeg core loading."}}
{"run":20,"commit":"da4d4c1","metric":3907,"metrics":{},"status":"keep","description":"Made MPEG-4 the primary Firefox transcode codec and kept H.264 as fallback, cutting hot-path conversion time substantially while preserving MP4 output and sync-related timestamp fixes.","timestamp":1774845389710,"segment":3,"confidence":null,"iterationTokens":3122,"asi":{"hypothesis":"FFmpeg WASM may encode MPEG-4 much faster than libx264 in Firefox while still producing a broadly compatible MP4 container.","learned":"This is a large real win on the harness: warm latency dropped from ~5.5s to ~3.9s. The expensive part was codec choice, not just worker overhead.","tradeoff":"Output codec is now MPEG-4 Part 2 by default instead of H.264, so future iterations should monitor file size and compatibility expectations before pushing quality-related tuning further.","next_action_hint":"Inspect parsed secondary metrics and then probe whether data-transfer overhead or FFmpeg core loading still leaves additional headroom, especially on the cold path."}}
{"run":21,"commit":"da4d4c1","metric":4518,"metrics":{},"status":"discard","description":"Removed `+faststart` from both the MPEG-4 primary path and H.264 fallback to test whether skipping moov relocation would speed Firefox conversion.","timestamp":1774845462694,"segment":3,"confidence":6.39443535188216,"iterationTokens":1975,"asi":{"hypothesis":"Since EasyCord already has the full MP4 blob before preview/download, `+faststart` may be unnecessary work and removing it could reduce encode time.","rollback_reason":"Warm conversion regressed badly (~3.9s → ~4.5s), so any container-writing savings were outweighed elsewhere in this workload.","learned":"`+faststart` is not the warm-path bottleneck here and may even interact favorably with the current muxing flow in FFmpeg WASM.","next_action_hint":"Keep the faster MPEG-4 default and try codec-parameter tuning or cold-start improvements instead of container flag removal."}}
