{"run":22,"commit":"543f666","metric":3560,"metrics":{},"status":"keep","description":"Raised the default MPEG-4 quantizer from q=6 to q=8, reducing encoder work and improving Firefox hot-path MP4 conversion time further.","timestamp":1774845512608,"segment":3,"confidence":7.432150313152401,"iterationTokens":825,"asi":{"hypothesis":"The new MPEG-4 default may still be spending unnecessary time on quality that is not critical for this lightweight browser recording workflow, so a slightly looser quantizer could materially reduce encode cost.","learned":"This produced another strong win (~3.9s → ~3.56s warm). MPEG-4 quality level is now a real lever, not just the codec family choice itself.","tradeoff":"Lower MPEG-4 quality is likely the reason for the speedup, so any further tuning should watch output size/visual plausibility instead of blindly pushing quantizer higher.","next_action_hint":"Try one more cautious step (for example q=9) or a small audio-bitrate reduction, then stop if gains flatten or quality tradeoffs feel too aggressive."}}
{"run":23,"commit":"96b003c","metric":3536,"metrics":{},"status":"keep","description":"Raised the default MPEG-4 quantizer one notch further from q=8 to q=9, yielding another small Firefox transcode speedup without changing the overall conversion path.","timestamp":1774845621789,"segment":3,"confidence":9.53099730458221,"iterationTokens":342,"asi":{"hypothesis":"There may still be a little excess video quality in the q=8 setting, so a one-step increase to q=9 could shave off more encode work while staying visually plausible.","learned":"The first q=9 run improved again (~3.56s → ~3.54s warm), though the gain is modest enough that confirmation is worth checking.","tradeoff":"This is now incremental tuning rather than a structural win; further quantizer increases may quickly run into diminishing returns or visible quality loss.","next_action_hint":"Use the immediate confirmation rerun to decide whether q=9 is a stable improvement or just benchmark noise."}}
{"run":24,"commit":"96b003c","metric":3460,"metrics":{},"status":"discard","description":"Re-ran the q=9 MPEG-4 setting unchanged to confirm whether the small improvement over q=8 was real.","timestamp":1774845629665,"segment":3,"confidence":15.014861995753716,"iterationTokens":342,"asi":{"hypothesis":"If q=9 is genuinely better than q=8, an immediate no-change rerun should stay in the same improved band rather than bouncing back above the prior 3.56s result.","rollback_reason":"No code change; confirmation-only run after already committing q=9.","learned":"The confirmation run came back even faster (~3.46s), so q=9 appears stably better than q=8 rather than a lucky one-off.","next_action_hint":"Try one last cautious codec-quality step such as q=10, but stop quickly if gains flatten or output-size reductions start looking too aggressive."}}
{"run":25,"commit":"96b003c","metric":3600,"metrics":{},"status":"discard","description":"Tried loosening the default MPEG-4 encoder one more step from q=9 to q=10 to see if Firefox warm conversion still improved.","timestamp":1774845684232,"segment":3,"confidence":25.257142857142856,"iterationTokens":2009,"asi":{"hypothesis":"If q=9 was not yet near the knee of the speed/quality curve, q=10 might shave off a bit more encoder time without destabilizing the workflow.","rollback_reason":"Warm transcode regressed relative to the q=9 commit, so the extra quality reduction did not buy more speed on this harness.","learned":"The useful quantizer sweet spot seems to be around q=9 for this workload; pushing beyond it did not continue the trend.","next_action_hint":"Shift focus away from further quantizer nudges and toward structural improvements such as cold-start reductions or worker/data-path overhead."}}
{"run":26,"commit":"57ef746","metric":3424,"metrics":{},"status":"keep","description":"Stopped cloning Firefox recording blobs into the worker and instead transferred the WebM `ArrayBuffer`, letting the worker write bytes directly to FFmpeg's virtual FS.","timestamp":1774845745943,"segment":3,"confidence":24.81159420289855,"iterationTokens":1501,"asi":{"hypothesis":"Even after the codec win, Blob cloning plus `fetchFile` may still waste time on the hot path; transferring raw bytes should reduce browser-side overhead before FFmpeg starts encoding.","learned":"This produced another meaningful improvement (~3.54s q=9 baseline band → ~3.42s). Data handoff overhead was small but still material enough to matter.","tradeoff":"The converter now eagerly materializes the Blob into an ArrayBuffer before posting, which is fine for the current flow but should be watched for peak memory on very large recordings.","next_action_hint":"Inspect cold metric too; if it still dominates, the next structural opportunity is likely FFmpeg core loading / asset delivery rather than more encode tuning."}}
{"run":27,"commit":"57ef746","metric":4003,"metrics":{},"status":"discard","description":"Lowered AAC bitrate from 128k to 96k on both the MPEG-4 primary path and the H.264 fallback to test whether lighter audio encoding would speed Firefox transcodes.","timestamp":1774845835738,"segment":3,"confidence":19.454545454545453,"iterationTokens":3262,"asi":{"hypothesis":"Audio work may still contribute enough to hot-path latency that a modest bitrate reduction could help without being noticeable for typical EasyCord recordings.","rollback_reason":"Warm latency regressed significantly, so this bitrate reduction did not reduce total encode work in a useful way for the harness.","learned":"Audio bitrate is not an effective lever here; the current bottleneck is dominated by video codec work and browser/FFmpeg overhead instead.","next_action_hint":"Avoid further audio-quality tuning and either pursue a user-visible cold-start optimization (prewarm/core loading) or stop on the current warm-path win set."}}
{"type":"config","name":"Optimize EasyCord Firefox first-conversion MP4 speed","metricName":"cold_transcode_ms","metricUnit":"ms","bestDirection":"lower"}
{"run":28,"commit":"e814fd1","metric":8487,"metrics":{},"status":"keep","description":"Rebased the session onto the user-visible first-conversion wait in Firefox, using the current best warm-path code as the cold-start baseline.","timestamp":1774845921911,"segment":4,"confidence":null,"iterationTokens":119,"asi":{"hypothesis":"After substantial warm-path wins, the most valuable remaining Firefox speed work is reducing the first stop-to-MP4 wait, which is dominated by worker/core initialization.","learned":"Current cold baseline is ~8.5s with warm still around ~3.5s, so there is still significant first-use headroom beyond the hot-path improvements already landed.","next_action_hint":"Pursue realistic cold-start reductions such as FFmpeg prewarming during recording or replacing remote core loading with faster local delivery."}}
{"run":29,"commit":"e144122","metric":5302,"metrics":{},"status":"keep","description":"Prewarmed the Firefox FFmpeg worker/core during recording and updated the benchmark to overlap that load with the recording window, cutting first-stop MP4 wait substantially.","timestamp":1774846008231,"segment":4,"confidence":null,"iterationTokens":2933,"asi":{"hypothesis":"The cold-path bottleneck is mostly FFmpeg initialization, so starting that work during recording should reduce the user-visible wait after stop even if total background work stays similar.","learned":"This was the big cold-start win: first-stop latency dropped from ~8.5s to ~5.3s while warm remained roughly unchanged. Hiding initialization behind recording time is highly effective.","tradeoff":"This shifts some CPU/network work earlier in the flow, so the remaining question is whether prewarming should happen at recording start only or even earlier.","next_action_hint":"Consider a cautious follow-up on even earlier prewarming (for example camera-ready time) or local FFmpeg core delivery, but only if it does not hurt overall UX too much."}}
{"run":30,"commit":"b39d1a1","metric":4093,"metrics":{},"status":"keep","description":"Stopped fetching FFmpeg core from `unpkg` at runtime and instead served the matching `@ffmpeg/core` assets locally through Vite, sharply reducing Firefox first-conversion latency.","timestamp":1774846405062,"segment":4,"confidence":3.6344086021505375,"iterationTokens":2316,"asi":{"hypothesis":"A large share of cold-start cost is remote core asset fetch + blobification, so bundling the exact FFmpeg core locally should make first conversion much faster and more deterministic.","learned":"This was another major cold-path win: first conversion dropped from ~5.3s to ~4.1s. Local asset delivery matters a lot more than the small warm regression.","tradeoff":"Warm conversion moved up modestly (~3.5s → ~3.8s), but the primary user-visible first-stop wait improved dramatically and the overall wall time fell too.","next_action_hint":"Validate whether the warm regression is real/noisy with a confirmation rerun, then consider one more UX-oriented preload timing change only if it helps cold further without excess background work."}}
{"run":31,"commit":"b39d1a1","metric":4083,"metrics":{},"status":"discard","description":"Re-ran the local-FFmpeg-core version unchanged to confirm the cold-start improvement and measure warm-path stability.","timestamp":1774846468878,"segment":4,"confidence":7.209187858900738,"iterationTokens":1113,"asi":{"hypothesis":"If serving FFmpeg core locally is a real win, the cold metric should reproduce in roughly the same 4.1s band on an immediate rerun.","rollback_reason":"No code change; confirmation-only run after already committing the local-core setup.","learned":"The cold-start gain reproduced almost exactly (~4.09s again). Warm stayed in the same ~3.76s band too, so the modest warm regression appears stable rather than noise.","next_action_hint":"Explore whether even earlier prewarming (camera-ready time) is worthwhile, since local asset delivery has already squeezed most of the raw load cost out of the current recording-start preload."}}
{"run":32,"commit":"b39d1a1","metric":4766,"metrics":{},"status":"discard","description":"Tried fully awaiting FFmpeg preload before recording begins, aligning the benchmark more aggressively with the camera-ready flow and moving app prewarm to camera startup.","timestamp":1774846598830,"segment":4,"confidence":6.528974739970282,"iterationTokens":6657,"asi":{"hypothesis":"Since EasyCord starts the camera before any recording and requires a 3-second gesture hold, making preload finish before recording starts might cut first-stop wait further.","rollback_reason":"Cold conversion regressed (~4.09s → ~4.77s), and warm also became noisier/slower, so this stronger preload timing did not help the measured stop wait.","learned":"The current non-blocking preload overlap is better than forcing preload completion before recording in this workflow. Starting background work earlier is fine; waiting for it is not.","next_action_hint":"Keep the non-blocking preload strategy and look for lighter-touch worker/core optimizations rather than more aggressive timing shifts."}}
{"run":33,"commit":"b39d1a1","metric":4106,"metrics":{},"status":"checks_failed","description":"Tried transferring the output MP4 bytes back from the worker as an `ArrayBuffer` instead of posting a Blob, but the build failed on worker-side `postMessage` typing.","timestamp":1774846666021,"segment":4,"confidence":12.626436781609195,"iterationTokens":1964,"asi":{"hypothesis":"Returning a transferred `ArrayBuffer` from the worker may reduce the final serialization/copy overhead compared with posting a Blob back to the main thread.","rollback_reason":"TypeScript rejected the worker `postMessage(..., [mp4Buffer])` call because the symbol was typed like `Window.postMessage`; the experiment could not be kept until the worker typing is fixed.","learned":"Even with the typing issue, the measured cold result (~4.1s) did not clearly beat the current best, so this path is at best marginal. Any retry should first fix typing via `self.postMessage`/worker-specific typing.","next_action_hint":"Only revisit output-buffer transfer if a clean worker-typed implementation is easy; otherwise focus on higher-leverage ideas since this one looks small."}}
{"run":34,"commit":"b39d1a1","metric":0,"metrics":{},"status":"crash","description":"Tried dropping the primary MPEG-4 path's forced CFR conversion (`-r 30` / `-vsync cfr`) to avoid extra frame-rate work, but the benchmark never completed.","timestamp":1774846950635,"segment":4,"confidence":12.626436781609195,"iterationTokens":2221,"asi":{"hypothesis":"If Firefox recordings already carry usable timestamps, skipping explicit CFR normalization could reduce transcode work and improve first-conversion latency.","rollback_reason":"The page never produced a benchmark result and the run hit the test timeout, implying the modified FFmpeg command hung or became pathologically slow on the sample.","learned":"The CFR/timestamp-normalization flags are likely doing essential work for this workflow; removing them is not a safe optimization path.","next_action_hint":"Keep the sync-related flags and focus on non-flag structural improvements instead of relaxing timestamp normalization."}}
{"run":35,"commit":"b39d1a1","metric":5741,"metrics":{},"status":"discard","description":"Tried serving FFmpeg core from stable `/public/ffmpeg/*` paths instead of Vite asset URLs to reduce dev-server indirection, then immediately re-ran to check whether the tiny first-run gain was real.","timestamp":1774847064112,"segment":4,"confidence":6.528974739970282,"iterationTokens":605,"asi":{"hypothesis":"Bypassing Vite's asset URL resolution and serving FFmpeg core from plain static public paths might shave a little more cold-start overhead from the local-core setup.","rollback_reason":"The first run looked only marginally better, but the confirmation run regressed badly (~5.74s cold), indicating this path is not a stable improvement and is likely just extra variance/noise.","learned":"The current local-core improvement comes from self-hosting itself, not from whether the files are addressed through Vite asset URLs versus plain public paths.","next_action_hint":"Keep the existing local-core setup and avoid micro-optimizing asset URL plumbing; the remaining headroom is probably elsewhere."}}
{"run":36,"commit":"b39d1a1","metric":4275,"metrics":{},"status":"discard","description":"Reduced worker-side message chatter by removing FFmpeg log forwarding and coarsening progress updates to 10% buckets.","timestamp":1774847130460,"segment":4,"confidence":10.159537572254335,"iterationTokens":1899,"asi":{"hypothesis":"Frequent worker→main-thread progress/log messages may add avoidable overhead during Firefox conversion, especially on the cold path.","rollback_reason":"Cold conversion regressed (~4.09s → ~4.28s) and warm got substantially worse too, so message chatter is not the bottleneck here.","learned":"The expensive part is core loading + encoding itself, not the small progress/log event traffic around it.","next_action_hint":"Stop chasing messaging overhead and focus only on ideas that remove real work, such as path selection or preload strategy."}}
{"run":37,"commit":"3d2609f","metric":3898,"metrics":{},"status":"keep","description":"Disabled MPEG-4 B-frames (`-bf 0`) in the primary Firefox transcode path, reducing encoder complexity and improving first-conversion latency again.","timestamp":1774847192829,"segment":4,"confidence":12.172413793103448,"iterationTokens":1470,"asi":{"hypothesis":"Firefox's FFmpeg WASM MPEG-4 path may spend avoidable time on B-frame decisions; forcing zero B-frames could speed encoding with minimal compatibility risk for these short browser recordings.","learned":"This improved both primary and secondary timing: cold dropped from ~4.09s to ~3.90s and warm also improved modestly. The MPEG-4 encoder still had meaningful structural headroom beyond quantizer tuning.","tradeoff":"Output size rose slightly, so this is buying speed via simpler frame structure rather than better compression efficiency.","next_action_hint":"Confirm this gain with one rerun, then consider one adjacent MPEG-4 simplification such as constraining GOP structure only if the confirmation holds."}}
{"run":38,"commit":"3d2609f","metric":5332,"metrics":{},"status":"discard","description":"Re-ran the `-bf 0` MPEG-4 change unchanged to confirm whether the new cold-path improvement was stable.","timestamp":1774847251600,"segment":4,"confidence":8.658490566037736,"iterationTokens":1071,"asi":{"hypothesis":"If removing B-frames is a robust win, an immediate no-change rerun should remain near the ~3.9s cold band instead of jumping back toward the older 4–5s range.","rollback_reason":"No code change; confirmation-only run after already committing the B-frame simplification.","learned":"The confirmation run was much slower (~5.33s cold), so this particular change appears highly unstable on the current harness and may be interacting badly with system variance.","next_action_hint":"Do not treat `-bf 0` as fully trusted yet; either probe one adjacent codec simplification from the now-restored baseline or look for improvements with lower variance than encoder micro-tuning."}}
{"run":39,"commit":"3d2609f","metric":4812,"metrics":{},"status":"discard","description":"Tried lengthening the MPEG-4 GOP (`-g 300`) on top of the current Firefox fast path to reduce keyframe work during short recordings.","timestamp":1774847324013,"segment":4,"confidence":6.953030303030303,"iterationTokens":2006,"asi":{"hypothesis":"If keyframe insertion is still costing meaningful encoder time, using a much longer GOP for these short browser recordings could reduce cold-start encode work.","rollback_reason":"Cold transcode regressed to ~4.81s and warm was also worse, so longer GOPs did not help this workload.","learned":"Keyframe cadence is not the bottleneck here; the prior gains came from codec/path selection and preload behavior, not GOP micro-tuning.","next_action_hint":"Avoid deeper MPEG-4 tuning unless a change removes substantial work. The remaining promising ideas are broader architectural ones, not keyframe tweaks."}}
{"run":40,"commit":"3d2609f","metric":3915,"metrics":{},"status":"discard","description":"Removed the primary path's `aresample=async=1` audio sync filter to test whether Firefox already provides good-enough audio timing without that extra work.","timestamp":1774847431161,"segment":4,"confidence":8.799616490891658,"iterationTokens":3103,"asi":{"hypothesis":"The audio resample sync filter may be unnecessary on the fast MPEG-4 path and could be adding avoidable cold-start work.","rollback_reason":"Cold timing was slightly worse than the current best and not convincingly better, so dropping the audio sync filter is not worth the compatibility risk.","learned":"`aresample=async=1` is not a meaningful bottleneck at the current scale. Even if it can be removed safely, it is not where the remaining latency lives.","next_action_hint":"Keep the safer sync filter and prefer experiments that remove larger chunks of work than an audio post-process flag."}}
{"run":41,"commit":"3d2609f","metric":5309,"metrics":{},"status":"discard","description":"Ran a third confirmation pass on the current `-bf 0` MPEG-4 commit to see whether the earlier fast result was reproducible or just noise.","timestamp":1774847519691,"segment":4,"confidence":6.953030303030303,"iterationTokens":3103,"asi":{"hypothesis":"If disabling B-frames is truly beneficial, repeated no-change reruns should cluster near the original ~3.9s cold result rather than bouncing back above 5s.","rollback_reason":"No code change; confirmation-only run against the current committed head.","learned":"The third run again landed in the slow ~5.3s band, so the earlier 3.9s result is not reliably reproducible. The commit may still be okay functionally, but its measured gain is too unstable to trust as a benchmark win.","next_action_hint":"Treat the current head as suspect for benchmark purposes; explore broader benchmark shaping or revert `-bf 0` in a fresh experiment if subsequent ideas need a more stable baseline."}}
{"run":42,"commit":"ab28b8c","metric":4138,"metrics":{},"status":"keep","description":"Backed out the unstable `-bf 0` MPEG-4 tweak after repeated confirmation failures, restoring the simpler q=9 local-core/preload path as the Firefox baseline.","timestamp":1774847623207,"segment":4,"confidence":8.799616490891658,"iterationTokens":772,"asi":{"hypothesis":"The apparent `-bf 0` win was benchmark noise; reverting it should restore the more stable cold-start behavior of the prior local-core setup.","learned":"Repeated runs without `-bf 0` clustered back in the ~4.1–4.2s cold band, which is slower than the single lucky `-bf 0` run but much more reproducible. Stability matters more than a one-off spike.","tradeoff":"This gives up a possibly spurious best-case low number in exchange for a more trustworthy configuration.","next_action_hint":"With encoder micro-tuning mostly exhausted, shift effort toward broadening the benchmark workload or other architectural overlaps rather than more ffmpeg flag nips and tucks."}}
{"type":"config","name":"Optimize EasyCord Firefox first-conversion MP4 speed (mixed short/long recordings)","metricName":"cold_transcode_ms","metricUnit":"ms","bestDirection":"lower"}
